company,home_economy,industry,sales_millions,employment,year_of_establishment,emne,nat_res_ind,former_col_power,bordering_country
Manufacture Burkinabe De Cigarettes SA,France,cigarettes,25.9,150.0,,False,False,True,False
Cica Burkina,France,cars and other motor vehicles,21.0,150.0,1991.0,False,False,True,False
Scac Delmas Vilejeu,France,freight transport arrangers,6.8,350.0,,False,False,True,False
Compagnie Burkinabe Pour La Transformation De Metaux SA,India,blast furnace and steel mills,6.0,100.0,,True,False,False,False
Societe Nationale Du Transit Burkina Sarl,France,freight transport arrangers,3.8,200.0,1995.0,False,False,True,False
Eeri,France,,,,,False,False,True,False
Sdv Burkina Faso,France,,,,,False,False,True,False
Ste Burkinabe Des Gaz Industriels,France,,,,,False,False,True,False
